{
  "annotation_schema_version": "1.0",
  "sample_id": "gold-v1-p0003",
  "document_sha256": "485771d63e747788d855d2ec033436239001f24a1d835d1e00a6ec9467c632fd",
  "page_number": 3,
  "layout_tags": [
    "SPECIAL_LAYOUT"
  ],
  "review_status": "HUMAN_VERIFIED",
  "reviewer_id": "wangsanqiang",
  "page_image_sha256": "70e447dfd4ed58e22d356ed006ca81bff5c9652a09e1cdda3bb39fc4797b0464",
  "blocks": [
    {
      "source_block_id": "491a4b21-9a6e-4fb2-88dc-dfd666888f27",
      "text": "2",
      "raw_text": "2",
      "block_type": "TEXT",
      "reading_order": 0,
      "bbox": {
        "x1": 0.49372798483025543,
        "y1": 0.9474990497691862,
        "x2": 0.5063391583598555,
        "y2": 0.9672376074351655,
        "unit": "normalized"
      },
      "confidence": 1.0,
      "source_engine": "pymupdf-native"
    },
    {
      "source_block_id": "f62900db-c076-4534-997f-52dec90d568c",
      "text": "目录\nCONTENTS",
      "raw_text": "目录\nCONTENTS",
      "block_type": "TEXT",
      "reading_order": 1,
      "bbox": {
        "x1": 0.1294119974878496,
        "y1": 0.12351112079969163,
        "x2": 0.3928698856278078,
        "y2": 0.20464515521475724,
        "unit": "normalized"
      },
      "confidence": 1.0,
      "source_engine": "pymupdf-native"
    },
    {
      "source_block_id": "8b341a70-eade-47c8-801f-19989b5c89da",
      "text": "Word List 01\nWord List 02\nWord List 03\nWord List 04\nWord List 05\nWord List 06\nWord List 07\nWord List 08\nWord List 09\nWord List 10\nWord List 11\nWord List 12\nWord List 13\nWord List 14\nWord List 15\nWord List 16\nWord List 17\nWord List 18\nWord List 19\nWord List 20\nWord List 21\nWord List 22\nWord List 23\nWord List 24\nWord List 25\nWord List 26\nWord List 27\nWord List 28\nWord List 29\nWord List 30\nWord List 31\nWord List 32",
      "raw_text": "Word List 01\nWord List 02\nWord List 03\nWord List 04\nWord List 05\nWord List 06\nWord List 07\nWord List 08\nWord List 09\nWord List 10\nWord List 11\nWord List 12\nWord List 13\nWord List 14\nWord List 15\nWord List 16\nWord List 17\nWord List 18\nWord List 19\nWord List 20\nWord List 21\nWord List 22\nWord List 23\nWord List 24\nWord List 25\nWord List 26\nWord List 27\nWord List 28\nWord List 29\nWord List 30\nWord List 31\nWord List 32",
      "block_type": "TEXT",
      "reading_order": 2,
      "bbox": {
        "x1": 0.14202487652628937,
        "y1": 0.24433131045148052,
        "x2": 0.2835874190998935,
        "y2": 0.89958008606195,
        "unit": "normalized"
      },
      "confidence": 1.0,
      "source_engine": "pymupdf-native"
    }
  ],
  "entries": [],
  "vocabulary": [],
  "review_notes": [
    "DRAFT_SCAFFOLD_ONLY: page identity is frozen; blocks, entries and vocabulary still require source-grounded annotation and human verification.",
    "MACHINE_PREANNOTATION_ONLY: content must be checked against the rendered source page before HUMAN_VERIFIED promotion.",
    "generator=vie-pipeline@a60ffcf",
    "HUMAN_REVIEW_NOTE:为非词条页",
    "HUMAN_SIGN_OFF:{\"checks\":[\"canonical_fields_match\",\"entry_boundaries_match\",\"page_boundaries_match\",\"source_blocks_match\"],\"page_classification\":null,\"reviewer_id\":\"wangsanqiang\",\"verified_at\":\"2026-10-01T19:15:58.988963+00:00\"}"
  ]
}
